{
  "id": "design.l3.event-sourcing",
  "generated_by": "claude-opus-5-5",
  "generated_at": "2026-10-15T00:00:00+07:00",
  "claims": [
    {
      "n": 1,
      "text": "Event sourcing stores an aggregate as the ordered list of events that happened to it, instead of storing its current state as the record; the state is worked out from those events when needed.",
      "kind": "fact",
      "source_hint": "refs/dotnet-docs/docs/architecture/ (Event Sourcing pattern); glossary event-sourcing; outline item 1",
      "needs_verification": true,
      "section": 3
    },
    {
      "n": 2,
      "text": "Each aggregate's events form one event stream numbered by version (in the sample, from 1, version = position in the list); an event store only appends to the end of a stream and never updates or deletes a saved event.",
      "kind": "fact",
      "source_hint": "glossary event-stream, event-store; examples/don-hang @ stage-3: InMemoryEventStore.cs:3-7",
      "needs_verification": true,
      "section": 3
    },
    {
      "n": 3,
      "text": "At stage-3, after placing then cancelling an order, order_status_history has rows placed and cancelled and outbox_messages has order.placed and order.cancelled; the cancel sets orders.status to cancelled.",
      "kind": "fact",
      "source_hint": "examples/don-hang @ stage-3: RecordOrderStatusHistory.cs:17-19, NotifyCustomerOnOrderEvents.cs:15-17, Entities.cs Cancel; scripts/design/order-history.sh",
      "needs_verification": true,
      "section": 2
    },
    {
      "n": 4,
      "text": "order_status_history holds order_id, event, status, occurred_at; an outbox OrderMessage holds OrderId, CustomerEmail, CustomerName, OccurredAt (plus routing key); neither holds the total or the order items.",
      "kind": "fact",
      "source_hint": "examples/don-hang @ stage-3: Migrations/20261005224255_AddOrderStatusHistory.cs:48, NotifyCustomerOnOrderEvents.cs:29-35, DonHang.Domain/OrderMessage.cs",
      "needs_verification": true,
      "section": 2
    },
    {
      "n": 5,
      "text": "EventSourcedOrder is a sample in samples/DonHang.Samples/Samples/Design/EventSourcing; Đơn Hàng's real Order is not event-sourced and is stored by its state in orders. The sample's OrderPlaced, declared above line 74, carries CustomerId and TotalVnd.",
      "kind": "fact",
      "source_hint": "examples/don-hang @ stage-3: EventSourcedOrder.cs:3-9; STAGE.md table row for EventSourcing/*",
      "needs_verification": true,
      "section": 3
    },
    {
      "n": 6,
      "text": "EventSourcedOrder.Cancel throws InvalidOperationException if Status is cancelled or shipped, otherwise calls Record(new OrderCancelled(Id, at)); a refused change records no event.",
      "kind": "fact",
      "source_hint": "examples/don-hang @ stage-3: EventSourcedOrder.cs:74-78",
      "needs_verification": true,
      "section": 4
    },
    {
      "n": 7,
      "text": "Record calls Apply then adds the event to newEvents; Apply only sets fields (OrderCancelled sets Status cancelled) and increments Version; MarkSaved clears newEvents.",
      "kind": "fact",
      "source_hint": "examples/don-hang @ stage-3: EventSourcedOrder.cs:86-121",
      "needs_verification": true,
      "section": 5
    },
    {
      "n": 8,
      "text": "In the sample, order 5 is placed then paid: its stream holds OrderPlaced as version 1 and OrderPaid as version 2; after a cancel and Save, the stream is at version 3.",
      "kind": "fact",
      "source_hint": "examples/don-hang @ stage-3: EventSourcingDemo.cs:14-35; outputs/stage-3/scripts/design/event-sourcing.txt:1-6",
      "needs_verification": true,
      "section": 4
    },
    {
      "n": 9,
      "text": "InMemoryEventStore.Save calls Append(order.Id, order.LoadedVersion, order.NewEvents) then order.MarkSaved(); Append adds events with AddRange after the existing ones (after a version check).",
      "kind": "fact",
      "source_hint": "examples/don-hang @ stage-3: InMemoryEventStore.cs:17-30, 46-51",
      "needs_verification": true,
      "section": 4
    },
    {
      "n": 10,
      "text": "InMemoryEventStore keeps Dictionary<int, List<OrderEvent>> streams (one per order id; version = position) and List<OrderEvent> all; its methods are Append, ReadStream, ReadAll, Load, Save, none changes or removes an event.",
      "kind": "fact",
      "source_hint": "examples/don-hang @ stage-3: InMemoryEventStore.cs:8-52",
      "needs_verification": true,
      "section": 5
    },
    {
      "n": 11,
      "text": "The sample's comment says a real event store keeps streams in a database where a unique (stream, version) key does the version check.",
      "kind": "fact",
      "source_hint": "examples/don-hang @ stage-3: InMemoryEventStore.cs:6-7; DECISIONS.md (outline cqrs-event-sourcing, item 2)",
      "needs_verification": true,
      "section": 5
    },
    {
      "n": 12,
      "text": "OrderService loads Order from orders and changes it; it never reads order_status_history; RecordOrderStatusHistory writes the history beside orders.",
      "kind": "fact",
      "source_hint": "examples/don-hang @ stage-3: DonHang.Domain/OrderService.cs; RecordOrderStatusHistory.cs:5-12",
      "needs_verification": true,
      "section": 5
    },
    {
      "n": 13,
      "text": "NotifyCustomerOnOrderEvents builds each message as OrderMessage(order.Id, customer.Email, customer.FullName, domainEvent.OccurredAt), one per event for the six events Order records.",
      "kind": "fact",
      "source_hint": "examples/don-hang @ stage-3: DonHang.Domain/NotifyCustomerOnOrderEvents.cs:11-35",
      "needs_verification": true,
      "section": 5
    },
    {
      "n": 14,
      "text": "At stage-3 order 7, already in the repository's data, is shipped in orders and its order_status_history holds only one placed row, because the AddOrderStatusHistory migration copied only a placed row for each existing order.",
      "kind": "fact",
      "source_hint": "examples/don-hang @ stage-3: outputs/stage-3/scripts/design/order-history.txt; lesson design.l3.read-model claim 14",
      "needs_verification": true,
      "section": 6
    },
    {
      "n": 15,
      "text": "Order.MarkPaid() at stage-3 sets Status to paid and records no domain event, so no outbox row and no history row follow from it.",
      "kind": "fact",
      "source_hint": "examples/don-hang @ stage-3: DonHang.Domain/Entities.cs:109-114",
      "needs_verification": true,
      "section": 6
    },
    {
      "n": 16,
      "text": "A message in Đơn Hàng's (quorum) queues can be discarded once a consumer acknowledges (has handled) it; a queue hands messages out from its head, so it offers no way to ask for one order's events by version. Not true of RabbitMQ streams, which Đơn Hàng does not use.",
      "kind": "behavior",
      "version_key": "rabbitmq",
      "source_hint": "RabbitMQ docs: Consumer Acknowledgements and Publisher Confirms; Quorum Queues; STAGE.md (quorum queue per service)",
      "needs_verification": true,
      "section": 6
    },
    {
      "n": 17,
      "text": "The Notifications service's OrderEventsConsumer consumes from notifications.order-events (BasicConsumeAsync, then BasicAckAsync per message) and never asks for an order's earlier messages.",
      "kind": "fact",
      "source_hint": "examples/don-hang @ stage-3: DonHang.Notifications/OrderEventsConsumer.cs:42-75; outputs/stage-3/scripts/backend/rabbitmq-topology.txt:8",
      "needs_verification": true,
      "section": 6
    },
    {
      "n": 18,
      "text": "scripts/design/event-sourcing.sh runs on the host with dotnet run --project samples/DonHang.Samples -- event-sourcing; its output starts with the stream of order 5 (version 1 OrderPlaced at 09:00, version 2 OrderPaid at 09:30) and a line 'A cancels and appends: the stream is now at version 3'.",
      "kind": "fact",
      "source_hint": "examples/don-hang @ stage-3: scripts/design/event-sourcing.sh; outputs/stage-3/scripts/design/event-sourcing.txt:1-6",
      "needs_verification": true,
      "section": 7
    },
    {
      "n": 19,
      "text": "Decide whether a system is event-sourced by what it loads as the truth: a history kept beside a state row is a read model, not event sourcing, even when it lists every change.",
      "kind": "opinion",
      "source_hint": "outline items 1 and 4, misconception 1",
      "needs_verification": false,
      "section": 6
    }
  ],
  "coverage": {
    "outline_items_covered": [1, 2, 3, 4, 5],
    "outline_items_missing": [],
    "beyond_scope": ["Try it runs scripts/design/event-sourcing.sh, whose later output (two writers, projections, snapshots) belongs to later lessons; the learner is told to read only the first block and the 'A cancels' line"]
  },
  "self_check": {
    "one_concept": true,
    "vocab_all_defined": true,
    "code_from_repo": true,
    "no_external_urls": true,
    "word_count": 1500,
    "notes": "apply-review 2026-10-15: §3 defs per claim 1/minor; §4 dropped unnamed check; §5 +OrderPlaced fields, +comment's check is outside excerpt; §6 no quorum/acknowledge/seed/management UI, +why order 7 has one row, +MarkPaid clause; claim 17 replaced by OrderEventsConsumer fact; §8 broker line per review; §9 line 1 'as the record'. Quiz q1/q4/q5 left to /quiz apply-review."
  },
  "open_questions": [],
  "repo_changes_needed": []
}
