{
  "id": "design.l4.evolutionary-architecture",
  "generated_by": "claude-opus-5-5",
  "generated_at": "2026-10-27T18:24:00+07:00",
  "claims": [
    {
      "n": 1,
      "text": "Stage-2: QueuedNotifier wrote a notifications row in the order's transaction; NotificationSender ran in every API copy. Stage-3: DonHang.Notifications sends emails. ADR 0002 was written after the split (lines 4-8); ADR 0008 before its steps.",
      "kind": "fact",
      "source_hint": "docs/adr/0002 lines 4-8, 12-15; docs/adr/0008 lines 3-6, 35; STAGE.md @ stage-3",
      "needs_verification": true,
      "section": 2
    },
    {
      "n": 2,
      "text": "At stage-3 the old notifications table is still in donhang, unread; the register says it was found later (debt N1) and ADR 0008 removes it in later steps; line 35: neither table dropped at stage-3.",
      "kind": "fact",
      "source_hint": "docs/adr/0002 lines 46-47; docs/adr/0008 line 35; docs/team/tech-debt-register.md line 18 @ stage-3",
      "needs_verification": true,
      "section": 2
    },
    {
      "n": 3,
      "text": "An evolutionary architecture changes in small, guided steps as its drivers change instead of being fixed up front; each step should leave the system working and be followed by a check that the quality attributes that matter still hold.",
      "kind": "opinion",
      "source_hint": "Outline items 1, 4, 5; glossary evolutionary-architecture",
      "needs_verification": false,
      "section": 4
    },
    {
      "n": 4,
      "text": "Which quality attributes matter depends on the drivers: separation of parts matters little to one shop and two developers, more once several services and teams change the system.",
      "kind": "opinion",
      "source_hint": "Outline item 2; design.l4.architectural-drivers",
      "needs_verification": false,
      "section": 4
    },
    {
      "n": 5,
      "text": "ADR 0002 secured that a slow email server no longer takes resources from the order-taking process (lines 20-21) and that Notifications does not read the customers table, because the message carries the customer's email and name (lines 38-39).",
      "kind": "fact",
      "source_hint": "docs/adr/0002-tach-notifications-thanh-service.md @ stage-3 lines 20-21, 38-39",
      "needs_verification": true,
      "section": 4
    },
    {
      "n": 6,
      "text": "ADR 0002 line 15: stage-2 design right for one process, two things changed; lines 17-21: Payments must also message customers, a slow email server takes resources of the order-taking process (line 20); lines 23-24: copy count alone was no reason.",
      "kind": "fact",
      "source_hint": "docs/adr/0002-tach-notifications-thanh-service.md @ stage-3 lines 10-24",
      "needs_verification": true,
      "section": 5
    },
    {
      "n": 7,
      "text": "ADR 0008 order: dump both tables (line 29), migration dropping notifications with PostgresFixture's TRUNCATE fixed in the same PR (30-31), payments dropped after accounting confirms (32-33); lines 50-53: the fixture clears both tables between tests, hence the fix in each PR.",
      "kind": "fact",
      "source_hint": "docs/adr/0008-xoa-bang-cu-trong-donhang.md @ stage-3 lines 29-33, 50-53",
      "needs_verification": true,
      "section": 5
    },
    {
      "n": 8,
      "text": "ADR 0008 removes N2, the old payments table left when Payments got its own DB, data copied to donhang_payments (lines 10-12, 46-47; register line 19). Lines 46-49: payments dropped only after accounting confirms; line 42: period with only old payments.",
      "kind": "fact",
      "source_hint": "docs/adr/0008 lines 10-12, 42, 46-49; docs/team/tech-debt-register.md line 19 @ stage-3",
      "needs_verification": true,
      "section": 5
    },
    {
      "n": 9,
      "text": "Up-front design costs a guess per driver and fits only guessed changes; checked steps cost checks and records; no design or checks pays nothing up front, its cost arriving when users find a lost quality attribute. Deciding early fits choices very costly to undo.",
      "kind": "opinion",
      "source_hint": "Outline items 1, 5; misconceptions 1, 3; opposing view for contested topic",
      "needs_verification": false,
      "section": 6
    },
    {
      "n": 10,
      "text": "Choices: keep ADR 0008's steps rather than one migration dropping both tables; design a very costly-to-undo decision more carefully up front; when no check exists for a secured quality attribute, make the step smaller and set up the check first, even a person's confirmation.",
      "kind": "opinion",
      "source_hint": "Outline items 4-5; docs/adr/0008 lines 46-49",
      "needs_verification": false,
      "section": 7
    },
    {
      "n": 11,
      "text": "ADR 0002 weighed two options, keep email as a module in DonHang.Api or split DonHang.Notifications (lines 26-34); ADR 0008 ordered its steps and changed them after accounting's and the tester's objections (lines 44-53).",
      "kind": "fact",
      "source_hint": "docs/adr/0002 lines 26-34; docs/adr/0008 lines 44-53 @ stage-3",
      "needs_verification": true,
      "section": 8
    },
    {
      "n": 12,
      "text": "Debt register @ stage-3: T2 (QueuedNotifier) repaid by the outbox, line 28; line 38: a repaid item moves to 'Nợ đã trả'. ADR 0002 lines 36-39: split with an outbox written in the order's transaction.",
      "kind": "fact",
      "source_hint": "docs/team/tech-debt-register.md lines 28, 38; docs/adr/0002 lines 36-39 @ stage-3",
      "needs_verification": true,
      "section": 9
    }
  ],
  "coverage": {
    "outline_items_covered": [1, 2, 3, 4, 5],
    "outline_items_missing": [],
    "beyond_scope": []
  },
  "self_check": {
    "one_concept": true,
    "vocab_all_defined": true,
    "code_from_repo": true,
    "no_external_urls": true,
    "word_count": 1800,
    "notes": "generate 2026-10-27; fitness function not named (next lesson); versions_used []. apply-review 2026-10-27: N1 'found later' (register l.18); check widened to before/after a step, s5/s9 reworded; ADR 0002 written afterwards (l.4-8); customers source l.38-39; no-branch narrated; N2 introduced; claim 9 suggested_text; options named; 'one process' glossed via l.20; q3 explanation reworded; s4 trimmed to stay in 150-300."
  },
  "open_questions": [],
  "repo_changes_needed": []
}
