{
  "id": "devops.l2.why-monitoring",
  "generated_by": "claude-opus-5-5",
  "generated_at": "2026-09-29T10:00:00+07:00",
  "claims": [
    {
      "n": 1,
      "text": "RequestLoggingMiddleware.InvokeAsync (stage-1:11-23) awaits next(context) and only afterwards calls LogInformation with the template \"{Method} {Path} responded {StatusCode} in {ElapsedMs}ms\"; if next throws, the log call is not reached.",
      "kind": "fact",
      "source_hint": "examples/don-hang @ stage-1: DonHang.Api/Middleware/RequestLoggingMiddleware.cs:11-23",
      "needs_verification": true,
      "section": 5
    },
    {
      "n": 2,
      "text": "At stage-1 ExceptionHandlingMiddleware is registered before RequestLoggingMiddleware in Program.cs, catches exceptions from later middleware and logs them (LogWarning/LogError) before writing the response.",
      "kind": "fact",
      "source_hint": "examples/don-hang @ stage-1: DonHang.Api/Program.cs:67-68; DonHang.Api/Middleware/ExceptionHandlingMiddleware.cs",
      "needs_verification": true,
      "section": 5
    },
    {
      "n": 3,
      "text": "docker-compose.yml@stage-1:82-88: service api, image donhang-api:stage-1, container_name donhang-api, hostname api; the api service (to line 99) has no logging setting, and no service in the stage-1 lab reads container output.",
      "kind": "fact",
      "source_hint": "examples/don-hang @ stage-1: docker-compose.yml:81-130",
      "needs_verification": true,
      "section": 5
    },
    {
      "n": 4,
      "text": "Docker keeps what a container writes to stdout/stderr, and docker compose logs <service> prints it; --since accepts a relative duration such as 5m or 2m.",
      "kind": "syntax",
      "source_hint": "Docker docs: docker compose logs (--since); Docker docs: View container logs",
      "needs_verification": true,
      "section": 4,
      "version_key": "docker"
    },
    {
      "n": 5,
      "text": "With the default console formatter, a LogInformation event from RequestLoggingMiddleware appears as 'info: DonHang.Api.Middleware.RequestLoggingMiddleware[0]' followed by an indented line like 'GET /api/v1/products responded 200 in 4ms'.",
      "kind": "behavior",
      "source_hint": "ASP.NET Core docs: Logging, console formatters (simple); backend.l1.structured-logging Try it (verified at stage-1)",
      "needs_verification": true,
      "section": 5,
      "version_key": "aspnetcore"
    },
    {
      "n": 6,
      "text": "docker compose logs api --since 5m | grep -c \"responded 5\" counts the lines of the last five minutes that contain 'responded 5' (grep -c prints the number of lines containing the text), so it matches responded 500, 503 alike.",
      "kind": "syntax",
      "source_hint": "Docker docs: docker compose logs; GNU grep manual (-c)",
      "needs_verification": true,
      "section": 4,
      "version_key": "docker"
    },
    {
      "n": 7,
      "text": "Log line = one event with details; metric = one number measured repeatedly; with a count held as a metric, failures in the last 5 minutes = value now minus value 5 minutes ago, unless the API restarted in between (a count kept by the process starts again from zero).",
      "kind": "fact",
      "source_hint": "Prometheus docs: Concepts / Data model (definition level)",
      "needs_verification": false,
      "section": 4
    },
    {
      "n": 8,
      "text": "Log volume grows with every request; a metric split by status code keeps one number per status code seen, so its size depends on how many distinct things it counts, not on traffic.",
      "kind": "fact",
      "source_hint": "Prometheus docs: Data model; Prometheus docs: Naming / label cardinality (principle level)",
      "needs_verification": false,
      "section": 4
    },
    {
      "n": 9,
      "text": "When the api container is stopped, Caddy's reverse_proxy api:8080 cannot reach an upstream and answers the request itself with an error status (a 5xx, such as 502); the API writes nothing about those requests.",
      "kind": "behavior",
      "source_hint": "Caddy docs: reverse_proxy (upstream errors -> 502); examples/don-hang @ stage-1: Caddyfile handle /api/v1/*; live run 2026-09-29: 502, no api log line",
      "needs_verification": true,
      "section": 7,
      "version_key": "caddy"
    },
    {
      "n": 10,
      "text": "Try it: after docker compose stop api, curl -s -o /dev/null -w \"%{http_code}\n\" (sends GET, prints only the status code) to localhost:8080/api/v1/products prints an error status from Caddy (a 5xx such as 502); docker compose logs api --since 2m has no line about those requests.",
      "kind": "behavior",
      "source_hint": "run on the stage-1 lab (Compose v2.33); Docker docs: docker compose stop/start/logs; live run 2026-09-29: 502, no api log line",
      "needs_verification": true,
      "section": 7,
      "version_key": "docker"
    },
    {
      "n": 11,
      "text": "Monitoring is continuous collection by programs, not a person watching a screen; the value is that numbers exist for periods nobody watched.",
      "kind": "opinion",
      "source_hint": "Prometheus docs: Overview (principle level)",
      "needs_verification": false,
      "section": 6
    },
    {
      "n": 12,
      "text": "A metric keeps a number and drops per-event details; logs keep the details, so a rise in a 5xx count still needs log lines to find which path failed.",
      "kind": "fact",
      "source_hint": "Prometheus docs: Data model (principle level)",
      "needs_verification": false,
      "section": 6
    },
    {
      "n": 13,
      "text": "Each request that returns normally adds two lines to the container output: the Simple console formatter prints one event as a header line and an indented message line.",
      "kind": "behavior",
      "source_hint": "ASP.NET Core docs: console log formatter (Simple)",
      "needs_verification": true,
      "section": 5,
      "version_key": "aspnetcore"
    }
  ],
  "coverage": {
    "outline_items_covered": [
      1,
      2,
      3,
      4,
      5
    ],
    "outline_items_missing": [],
    "beyond_scope": []
  },
  "self_check": {
    "one_concept": true,
    "vocab_all_defined": true,
    "code_from_repo": true,
    "no_external_urls": true,
    "word_count": 1250,
    "notes": "stage-1 lesson (DECISIONS §3 outline (1)). No trace/OTel/alert/SLO. R1 tech: 'cannot start' removed; Try it 502 softened to 5xx; restart condition; per-request wording; caddy in versions_used; q4 'order' removed. R1 junior: Caddy/grep/curl glossed, 'lab' removed, split metric, dashed part, q1a/q4c reworded. R2 minors: restart resets count, summary 'event', up.sh, q4b."
  },
  "open_questions": [],
  "repo_changes_needed": []
}
