{
  "id": "devops.l3.rollback-by-revert",
  "generated_by": "claude-opus-5-5",
  "generated_at": "2026-10-21T23:00:00+07:00",
  "claims": [
    {
      "n": 1,
      "text": "Argo CD syncs a commit whose image tag does not exist in the registry like any other: it compares manifests with live objects and does not check the registry; after the sync the Application is Synced.",
      "kind": "behavior",
      "source_hint": "Argo CD docs: Core Concepts (sync, sync status); outputs/stage-3/scripts/devops/gitops-revert.txt lines 1-2",
      "needs_verification": true,
      "section": 3,
      "version_key": "argocd"
    },
    {
      "n": 2,
      "text": "With the Deployment's default RollingUpdate strategy (no strategy set in api.yaml) and 2 replicas, the update creates one new Pod and removes no old Pod until a new one is ready (maxUnavailable 25% rounds down to 0, maxSurge 25% rounds up to 1).",
      "kind": "behavior",
      "source_hint": "Kubernetes docs: Deployments > Strategy > Rolling Update (Max Unavailable, Max Surge); envs/staging/api.yaml @ stage-3; output lines 3-4",
      "needs_verification": true,
      "section": 4,
      "version_key": "kubernetes"
    },
    {
      "n": 3,
      "text": "A Pod whose image tag does not exist reports waiting reason ErrImagePull (later ImagePullBackOff, the same failed pull); while it is not ready, the Application shows Progressing, not Healthy (a snapshot seconds after the sync).",
      "kind": "behavior",
      "source_hint": "Kubernetes docs: Images > ImagePullBackOff; Argo CD docs: Resource Health (Deployment); output lines 2-4",
      "needs_verification": true,
      "section": 4,
      "version_key": "argocd"
    },
    {
      "n": 4,
      "text": "kubectl rollout undo changes only the live Deployment (its Pod template back to the previous revision), not the manifest in Git; output prints 'deployment.apps/api rolled back' and the Deployment then names the previous tag.",
      "kind": "behavior",
      "source_hint": "Kubernetes docs: Deployments > Rolling Back a Deployment; kubectl rollout undo; output lines 6-9",
      "needs_verification": true,
      "section": 3,
      "version_key": "kubernetes"
    },
    {
      "n": 5,
      "text": "With selfHeal on, after kubectl rollout undo the live Deployment differs from Git, Argo CD syncs again and the Deployment names the bad tag again shortly after (within the script's 120 s wait), with no new commit.",
      "kind": "behavior",
      "source_hint": "Argo CD docs: Automated Sync Policy > Automatic Self-Healing; gitops-revert.sh:38-41 and output lines 9-10 @ stage-3",
      "needs_verification": true,
      "section": 4,
      "version_key": "argocd"
    },
    {
      "n": 6,
      "text": "Without self-heal, a sync of any later commit applies every object of the Application and would set the api's tag back to the one Git names.",
      "kind": "behavior",
      "source_hint": "Argo CD docs: Sync Options > Selective Sync ('when syncing using auto sync Argo CD applies every object'); devops.l3.self-heal claim 5",
      "needs_verification": true,
      "section": 4,
      "version_key": "argocd"
    },
    {
      "n": 7,
      "text": "Argo CD can roll an Application back to a revision it synced earlier, but rollback cannot be performed against an Application with automated sync enabled.",
      "kind": "behavior",
      "source_hint": "Argo CD docs: Automated Sync Policy ('Rollback cannot be performed against an application with automated sync enabled'); argocd app rollback reference",
      "needs_verification": true,
      "section": 3,
      "version_key": "argocd"
    },
    {
      "n": 8,
      "text": "git revert creates a new commit whose change is the reverse of the given commit's; the reverted commit stays in the history. --no-edit uses the default message 'Revert \"<subject>\"' without opening an editor.",
      "kind": "behavior",
      "source_hint": "git-scm.com/docs/git-revert (DESCRIPTION, --no-edit); output line 15",
      "needs_verification": true,
      "section": 4,
      "version_key": "git"
    },
    {
      "n": 9,
      "text": "After the revert commit is pushed, Argo CD syncs it, the api rolls out on the previous tag, and the Application reports Synced, Healthy with 2 ready Pods on 1.0.0.",
      "kind": "behavior",
      "source_hint": "gitops-revert.sh:48-56 and output lines 12-14 @ stage-3",
      "needs_verification": true,
      "section": 5,
      "version_key": "argocd"
    },
    {
      "n": 10,
      "text": "A revert changes only files in the config repository; migrations a hook already applied stay recorded in the database, so the older api runs against the newer schema.",
      "kind": "behavior",
      "source_hint": "EF Core docs: Applying Migrations > Bundles (applies pending migrations, records them in the history table); devops.l3.ordering-a-sync",
      "needs_verification": true,
      "section": 4
    },
    {
      "n": 11,
      "text": "Going back past a schema change works only when the older api was written to work with the newer schema; when it is not, the way forward is a new deploy commit naming an image that works with the newer schema.",
      "kind": "opinion",
      "source_hint": "Outline item 5; depth_notes exclude expand/contract (stage 4)",
      "needs_verification": false,
      "section": 4
    },
    {
      "n": 12,
      "text": "git reset of main plus force-push (server branch made to match, commits may be dropped) makes Argo CD sync the good manifests; a clone that pulled the bad commit pushes a new one on top as a plain fast-forward (server branch is an ancestor), bringing it back.",
      "kind": "behavior",
      "source_hint": "git-scm.com/docs/git-reset, git-push (--force, fast-forward); Argo CD docs: Tracking and Deployment Strategies (targetRevision branch)",
      "needs_verification": true,
      "section": 6,
      "version_key": "git"
    },
    {
      "n": 13,
      "text": "When Argo CD manages a Deployment, a rollback should be a revert commit in the config repository rather than kubectl rollout undo or a reset and force-push.",
      "kind": "opinion",
      "source_hint": "Outline items 2-4, misconceptions 1-2",
      "needs_verification": false,
      "section": 6
    },
    {
      "n": 14,
      "text": "gitops-revert.sh: 9-10 set good (read from the working clone's envs/staging/api.yaml) and bad (sha- of zeros); 11-15 api_images; 25-26 replace the tag and commit/push; 27 refresh; 28-29 wait for the sync, print Synced, Progressing; 30 wait for ErrImagePull/ImagePullBackOff.",
      "kind": "fact",
      "source_hint": "examples/don-hang @ stage-3 scripts/devops/gitops-revert.sh:9-31; scripts/lib/gitops.sh (config_commit, app_refresh, app_wait_sync, app_wait)",
      "needs_verification": true,
      "section": 5
    },
    {
      "n": 15,
      "text": "gitops-revert.sh: 38 rollout undo; 39 print tag right after; 40 wait up to 120 s for the bad tag; 48 git revert --no-edit HEAD; 50-51 push; 52-54 refresh, wait for sync, print Synced, Healthy; 55 rollout status; 56 api_images; 57 git log -n 3.",
      "kind": "fact",
      "source_hint": "examples/don-hang @ stage-3 scripts/devops/gitops-revert.sh:34-57; outputs/stage-3/scripts/devops/gitops-revert.txt",
      "needs_verification": true,
      "section": 5
    },
    {
      "n": 16,
      "text": "In the script, the bad commit and its revert each change only the api image line of envs/staging/api.yaml (the migration hook's tag is not changed); the captured run started from tag 1.0.0.",
      "kind": "fact",
      "source_hint": "gitops-revert.sh:9,25-26,48; outputs/stage-3/scripts/devops/gitops-revert.txt lines 3, 9; gitops-deploy.txt (last tag 1.0.0)",
      "needs_verification": true,
      "section": 5
    },
    {
      "n": 17,
      "text": "The elided output line after 'kubectl rollout undo' is a kubectl warning about Pod security settings; the capture hides commit ids in git log output as '...'.",
      "kind": "fact",
      "source_hint": "outputs/stage-3/scripts/devops/gitops-revert.txt line 7, lines 15-17; outputs/unstable.regex",
      "needs_verification": true,
      "section": 5
    }
  ],
  "coverage": {
    "outline_items_covered": [1, 2, 3, 4, 5],
    "outline_items_missing": [],
    "beyond_scope": []
  },
  "self_check": {
    "one_concept": true,
    "vocab_all_defined": true,
    "code_from_repo": true,
    "no_external_urls": true,
    "word_count": 1500,
    "notes": "apply-review 2026-10-21: s6 'after a minute'->'shortly after', 'compares'->'next syncs'; s4 'stays'->'shows' (c3); s5 lines 55/56 credited (c15); force-push said plainly + why teammate's push is accepted (c12); ErrImagePull/ImagePullBackOff clause; ghcr.io tied to registry; fix-forward sentence (c11). Cut: kubectl scale aside, 'Not every bad deploy', Try-it clause. Quiz q2 option a left to /quiz. api.yaml not quoted (tag differs from run)."
  },
  "open_questions": [],
  "repo_changes_needed": []
}
