{
  "id": "k8s.l2.config-repo-overlays",
  "generated_by": "claude-opus-5-5",
  "generated_at": "2026-10-14T23:00:00+07:00",
  "claims": [
    {
      "n": 1,
      "text": "When an Application names no tool, Argo CD detects it from the source folder's files: a kustomization.yaml (or .yml / Kustomization) means Kustomize; otherwise a plain directory. apps/staging.yaml names no tool, so it needs no change.",
      "kind": "behavior",
      "version_key": "argocd",
      "source_hint": "argo-cd.readthedocs.io: User Guide > Tools > Tool Detection; User Guide > Kustomize",
      "needs_verification": true,
      "section": 4
    },
    {
      "n": 2,
      "text": "At stage-3 apps/staging.yaml names path envs/staging (Gitea config repo, main) and syncPolicy.automated with selfHeal and prune: true; no tool. apps/ holds staging, edge-staging, policies-staging, traefik: none syncs envs/production.",
      "kind": "fact",
      "source_hint": "examples/don-hang deploy/gitops/config-repo/apps/*.yaml at stage-3",
      "needs_verification": false,
      "section": 4
    },
    {
      "n": 3,
      "text": "The script moves staging's manifests to base/ except sealed-* (kept) and api-configmap.yaml (removed), removes envs/production; config_take writes each kustomization.yaml from config-repo-kustomize/ into the local copy .gitops/donhang-config, minus files it lacks. One commit, pushed.",
      "kind": "fact",
      "source_hint": "examples/don-hang scripts/k8s/kustomize-config-repo.sh lines 21-44; scripts/lib/gitops.sh config_repo, config_take (lines 78-96); outputs/stage-3/scripts/k8s/kustomize-config-repo.txt",
      "needs_verification": false,
      "section": 4
    },
    {
      "n": 4,
      "text": "Merge patch spec.syncPolicy.automated: null removes automated sync; Argo CD then only reports differences. config_commit commits, pushes; app_refresh sets argocd.argoproj.io/refresh so Argo CD compares now, not at its periodic repo check; config_head --verify prints the full commit id.",
      "kind": "behavior",
      "version_key": "argocd",
      "source_hint": "argo-cd.readthedocs.io: Automated Sync Policy; refresh annotation; examples/don-hang scripts/lib/gitops.sh config_commit, app_refresh, config_head at stage-3",
      "needs_verification": true,
      "section": 5
    },
    {
      "n": 5,
      "text": "Before the sync, Argo CD marks exactly three objects OutOfSync: ConfigMap api (no longer rendered), ConfigMap api-<hash> (new) and Deployment api (envFrom now names the generated ConfigMap); after the sync one ConfigMap api-<hash> remains and the api has one new ReplicaSet.",
      "kind": "behavior",
      "version_key": "argocd",
      "source_hint": "examples/don-hang outputs/stage-3/scripts/k8s/kustomize-config-repo.txt (real run); base/kustomization.yaml configMapGenerator api",
      "needs_verification": true,
      "section": 4
    },
    {
      "n": 6,
      "text": "With prune: true in apps/staging.yaml, the automated sync deletes an object whose manifest left the rendered source (the old ConfigMap api); the changed Pod template of Deployment api starts a rollout, one new ReplicaSet.",
      "kind": "behavior",
      "version_key": "argocd",
      "source_hint": "argo-cd.readthedocs.io: Automated Sync Policy > Automatic Pruning; kubernetes.io: Concepts > Workloads > Deployments (rollout on .spec.template change)",
      "needs_verification": true,
      "section": 4
    },
    {
      "n": 7,
      "text": "After the script's excerpt it applies apps/staging.yaml again (automated sync with prune back on) and waits for Synced, Healthy.",
      "kind": "fact",
      "source_hint": "examples/don-hang scripts/k8s/kustomize-config-repo.sh lines 56-64",
      "needs_verification": false,
      "section": 5
    },
    {
      "n": 8,
      "text": "envs/production/kustomization.yaml at stage-3 holds an images entry per image with newTag and digest; the comment says promoting to production is one change there, the tag and digest deploy-verified.sh verified for staging.",
      "kind": "fact",
      "source_hint": "examples/don-hang deploy/gitops/config-repo-kustomize/envs/production/kustomization.yaml lines 17-39 at stage-3",
      "needs_verification": false,
      "section": 4
    },
    {
      "n": 9,
      "text": "A change to the base is part of every overlay's rendered output, so it reaches every environment whose Application syncs that overlay at its next sync.",
      "kind": "behavior",
      "version_key": "kustomize",
      "source_hint": "kubectl.docs.kubernetes.io: Guides > Bases and Overlays",
      "needs_verification": true,
      "section": 4
    },
    {
      "n": 10,
      "text": "ci.yml 337-352: runs only if some envs/*/kustomization.yaml exists (hashFiles); per overlay of config-repo-kustomize in Đơn Hàng's repo, empty sealed-*.yaml stand-ins, kubectl kustomize piped into the $KUBECONFORM image (v0.8.0), -strict -kubernetes-version 1.34.0 -. No CI on config-repo commits.",
      "kind": "fact",
      "source_hint": "examples/don-hang .github/workflows/ci.yml lines 303-352 at stage-3",
      "needs_verification": false,
      "section": 5
    },
    {
      "n": 11,
      "text": "kubeconform validates Kubernetes manifests against the JSON schemas of the given Kubernetes version; '-' as the file argument reads from standard input; -strict rejects properties not in the schema.",
      "kind": "syntax",
      "version_key": "kubeconform",
      "source_hint": "github.com/yannh/kubeconform README: Usage (-strict: disallow additional properties not in schema; '-' reads stdin)",
      "needs_verification": true,
      "section": 5
    },
    {
      "n": 12,
      "text": "Each Argo CD Application renders its own source, so one cluster can hold Applications from Helm charts (apps/traefik.yaml) and from Kustomize folders (apps/staging.yaml).",
      "kind": "behavior",
      "version_key": "argocd",
      "source_hint": "argo-cd.readthedocs.io: User Guide > Tools; examples/don-hang deploy/gitops/config-repo/apps/traefik.yaml, apps/staging.yaml",
      "needs_verification": true,
      "section": 6
    },
    {
      "n": 13,
      "text": "Opinion: overlays for your own manifests installed a few times with few differences, charts for software others maintain (Traefik, the Ingress controller); a team installing its app many times with many settings, or shipping it, may prefer a chart whose values file lists the settings to change.",
      "kind": "opinion",
      "version_key": "helm",
      "source_hint": "outline item 6; helm.sh: Chart Best Practices > Values",
      "needs_verification": false,
      "section": 5
    },
    {
      "n": 14,
      "text": "Try it: rendering envs/production prints one donhang-api image line containing the digest of line 24 (sha256:4f05…83d); after changing that digest the line contains the changed one; nothing is applied. base/api.yaml has the only donhang-api reference.",
      "kind": "behavior",
      "version_key": "kustomize",
      "source_hint": "kubectl.docs.kubernetes.io: kustomization > images (digest); production kustomization.yaml line 24; base/api.yaml:33; run locally to confirm",
      "needs_verification": true,
      "section": 7
    },
    {
      "n": 15,
      "text": "A Kustomize overlay's patches add or override fields on objects the base builds; kind and name stay unchanged unless allowKindChange/allowNameChange is set.",
      "kind": "behavior",
      "version_key": "kustomize",
      "source_hint": "kubectl.docs.kubernetes.io: kustomization > patches",
      "needs_verification": true,
      "section": 6
    }
  ],
  "coverage": {
    "outline_items_covered": [1, 2, 3, 4, 5, 6],
    "outline_items_missing": [],
    "beyond_scope": []
  },
  "self_check": {
    "one_concept": true,
    "vocab_all_defined": true,
    "code_from_repo": true,
    "no_external_urls": true,
    "word_count": 1400,
    "notes": "apply-review vòng 3: 'clone' → 'local copy… pushes the commit back'; 'copies' → 'writes… leaving out files' (claim 3); 'next interval' → 'periodic check' (claim 4); Try it: 'ending in' → 'contains' digest vì không chạy được kubectl kustomize (claim 14 vẫn unverified, cần capture-output). Cắt chữ ở §4 bù. Quiz không đổi."
  }
}
