{
  "id": "backend.l3.tenant-isolation-models",
  "generated_by": "claude-opus-5-5",
  "generated_at": "2026-10-19T12:00:00+07:00",
  "claims": [
    {
      "n": 1,
      "text": "Đơn Hàng's own database stays single-shop at stage-3; the layouts run on lab databases: donhang_tenancy (shared tables in public, schemas shop_1/shop_2) and donhang_shop_1/donhang_shop_2 (a database per shop), all holding the same orders split by shop.",
      "kind": "fact",
      "source_hint": "examples/don-hang @ stage-3: db/tenancy/*.sql, scripts/backend/tenancy-db.sh, STAGE.md; DECISIONS.md §3 2026-10-06 outline multitenancy-and-sharding",
      "needs_verification": true,
      "section": 4
    },
    {
      "n": 2,
      "text": "A PostgreSQL schema is a named namespace inside one database that contains tables; same-named tables in two schemas (shop_1.orders, shop_2.orders) are separate. Every new database has a schema public, where tables created without a schema name go.",
      "kind": "fact",
      "source_hint": "PostgreSQL 17 docs: 5.10.1 Creating a Schema; 5.10.2 The Public Schema",
      "version_key": "postgresql",
      "needs_verification": true,
      "section": 4
    },
    {
      "n": 3,
      "text": "search_path is the ordered list of schemas PostgreSQL searches for a table name written without a schema; SET changes it for the current connection (session) only; after SET search_path TO shop_2 the name orders resolves to shop_2.orders.",
      "kind": "behavior",
      "source_hint": "PostgreSQL 17 docs: 5.10.3 The Schema Search Path; SQL command SET (effect lasts until end of session)",
      "version_key": "postgresql",
      "needs_verification": true,
      "section": 4
    },
    {
      "n": 4,
      "text": "A schema-qualified name such as shop_1.orders refers to that schema's table regardless of search_path; a connection that never sets search_path uses the default \"$user\", public (public last; no donhang schema exists), so in donhang_tenancy orders is public.orders.",
      "kind": "behavior",
      "source_hint": "PostgreSQL 17 docs: 5.10.3 The Schema Search Path (qualified names; default \"$user\", public)",
      "version_key": "postgresql",
      "needs_verification": true,
      "section": 6
    },
    {
      "n": 5,
      "text": "A PostgreSQL connection is made to one database; a query cannot read another database's tables, and naming one (donhang_shop_2.public.orders) gets ERROR: cross-database references are not implemented.",
      "kind": "behavior",
      "source_hint": "PostgreSQL 17 docs: 22.1 Overview (Managing Databases); examples/don-hang @ stage-3 outputs/stage-3/scripts/backend/tenancy-models.txt",
      "version_key": "postgresql",
      "needs_verification": true,
      "section": 4
    },
    {
      "n": 6,
      "text": "In shared-schema.sql lines 9-29 @ stage-3, customers and orders have PRIMARY KEY (shop_id, id), orders has FOREIGN KEY (shop_id, customer_id) REFERENCES customers (shop_id, id) on line 27, and index orders_shop_id_customer_id (shop_id, customer_id) on line 29.",
      "kind": "fact",
      "source_hint": "examples/don-hang @ stage-3 db/tenancy/shared-schema.sql lines 9-29",
      "needs_verification": true,
      "section": 5
    },
    {
      "n": 7,
      "text": "A composite foreign key (shop_id, customer_id) referencing customers (shop_id, id) makes PostgreSQL reject an order whose customer is not a row of the same shop; a key on (shop_id, id) lets each shop reuse id values from 1.",
      "kind": "behavior",
      "source_hint": "PostgreSQL 17 docs: 5.5.5 Foreign Keys (multicolumn), 5.5.4 Primary Keys",
      "version_key": "postgresql",
      "needs_verification": true,
      "section": 5
    },
    {
      "n": 8,
      "text": "A B-tree index whose first column is shop_id lets a query with WHERE shop_id = X read only that shop's part of the index; an index not starting with shop_id cannot narrow a search to one shop by itself.",
      "kind": "behavior",
      "source_hint": "PostgreSQL 17 docs: 11.3 Multicolumn Indexes; lesson backend.l2.composite-indexes",
      "version_key": "postgresql",
      "needs_verification": true,
      "section": 4
    },
    {
      "n": 9,
      "text": "schema-per-shop.sql @ stage-3 creates schemas shop_1 and shop_2, each with an orders table that has no shop_id column.",
      "kind": "fact",
      "source_hint": "examples/don-hang @ stage-3 db/tenancy/schema-per-shop.sql",
      "needs_verification": true,
      "section": 5
    },
    {
      "n": 10,
      "text": "tenancy-models.sh @ stage-3: sql() (lines 11-13) wraps psql --host db, --dbname picks the database; lines 15-28 read shop 2's orders thrice (1 paid, 2 new); || true continues past the join error; lines 33-49 run ALTER TABLE ... gift_note in BEGIN/ROLLBACK per table.",
      "kind": "fact",
      "source_hint": "examples/don-hang @ stage-3 scripts/backend/tenancy-models.sh lines 11-49; outputs/stage-3/scripts/backend/tenancy-models.txt; bash manual (|| list)",
      "needs_verification": true,
      "section": 5
    },
    {
      "n": 11,
      "text": "Each layout step from shared tables to a database per shop gives stronger isolation (and a database per shop can be backed up on its own) at the cost of repeating migrations, connections and monitoring per shop; holds when shops are managed by one team on one code base.",
      "kind": "opinion",
      "source_hint": "general multi-tenant SaaS design reasoning; PostgreSQL docs pg_dump (dumps one database)",
      "needs_verification": false,
      "section": 5
    },
    {
      "n": 12,
      "text": "Layouts can be mixed: when one shop is far larger than the rest, it can get its own database while small shops share tables, with the api choosing the connection by shop.",
      "kind": "opinion",
      "source_hint": "general multi-tenant design reasoning; outline item 6",
      "needs_verification": false,
      "section": 5
    },
    {
      "n": 13,
      "text": "A database per shop should not be the default when there are many small shops, because per-shop repetition is a common source of failures; it is right when a contract requires separation or when there are few, large shops.",
      "kind": "opinion",
      "source_hint": "general multi-tenant design reasoning; opposing view stated in the same bullet",
      "needs_verification": false,
      "section": 6
    },
    {
      "n": 14,
      "text": "When one migration runs per database, it can succeed on some shops' databases and not on others, leaving the api with tables of two different versions.",
      "kind": "behavior",
      "source_hint": "PostgreSQL 17 docs: transactions are per database/connection (no cross-database transaction); backend.l1.migrations",
      "version_key": "postgresql",
      "needs_verification": true,
      "section": 6
    },
    {
      "n": 15,
      "text": "DonHang.Payments has its own database, donhang_payments, on the same PostgreSQL server as donhang at stage-3.",
      "kind": "fact",
      "source_hint": "examples/don-hang @ stage-3 docker-compose.yml payments service; lesson backend.l3.payments-service",
      "needs_verification": true,
      "section": 8
    },
    {
      "n": 16,
      "text": "Try it: with scripts/up.sh running (it starts the database and the lab box), tenancy-models.sh calls tenancy-db.sh --if-missing, which builds the lab databases only if donhang_tenancy does not exist yet.",
      "kind": "fact",
      "source_hint": "examples/don-hang @ stage-3 scripts/up.sh lines 1-3; scripts/backend/tenancy-db.sh lines 12-17; tenancy-models.sh lines 6-9",
      "needs_verification": true,
      "section": 7
    }
  ],
  "coverage": {
    "outline_items_covered": [1, 2, 3, 4, 5, 6],
    "outline_items_missing": [],
    "beyond_scope": [
      "names the default search_path (ends in public; reads public.orders in the lab) only to support misconception 1",
      "mentions backup per shop only as a benefit (outline item 5), no backup/restore procedure"
    ]
  },
  "self_check": {
    "one_concept": true,
    "vocab_all_defined": true,
    "code_from_repo": true,
    "no_external_urls": true,
    "word_count": 1450,
    "notes": "apply-review: RLS line hedged; cannot name->read; 'any query' narrowed; 'common source'; --if-missing scoped (claim 16). Junior: 'session' (glossary = login) replaced by connection; explained public, default path, sql/psql, shops, || true; line refs by content; practice-db paragraph before diagram; owner in situation; up.sh step. Quiz: session->connection, q3 c + explanation."
  },
  "open_questions": [],
  "repo_changes_needed": []
}
