{
  "id": "devops.l1.secrets-vs-config",
  "generated_by": "claude-opus-5-5",
  "generated_at": "2026-09-27T22:10:00+07:00",
  "claims": [
    {
      "n": 1,
      "text": ".gitignore@stage-1 lines 1-2 are .env and secrets/; ignored untracked paths are not picked up by git add (without --force); git check-ignore -v reports .gitignore:1:.env and .gitignore:2:secrets/.",
      "kind": "fact",
      "source_hint": "examples/don-hang @ stage-1: .gitignore:1-2; generator check",
      "needs_verification": true,
      "section": 5
    },
    {
      "n": 2,
      "text": "scripts/dev-secrets.sh (run first by scripts/up.sh) writes .env with a fixed fake POSTGRES_PASSWORD if .env is missing, appends JWT_SIGNING_KEY from openssl rand -base64 48 if absent, and creates secrets/lab_key (ed25519) if missing.",
      "kind": "fact",
      "source_hint": "examples/don-hang @ stage-1: scripts/dev-secrets.sh:8-28; scripts/up.sh",
      "needs_verification": true,
      "section": 5
    },
    {
      "n": 3,
      "text": "Compose replaces ${VAR} in docker-compose.yml with values from the project .env file unless the shell sets the variable (shell wins); docker compose config prints the resolved file with substituted values.",
      "kind": "behavior",
      "source_hint": "Docker docs: Compose variable interpolation, docker compose config",
      "needs_verification": true,
      "section": 5,
      "version_key": "docker"
    },
    {
      "n": 4,
      "text": ".gitignore has no effect on files Git already tracks and changes nothing in past commits; a file committed earlier stays in every commit that contained it and can be read from any clone.",
      "kind": "behavior",
      "source_hint": "Git docs: gitignore (files already tracked are not affected)",
      "needs_verification": true,
      "section": 4
    },
    {
      "n": 5,
      "text": "git log --oneline -- .env lists commits on the current branch that added, changed or deleted .env; in the stage-1 repository it prints nothing.",
      "kind": "behavior",
      "source_hint": "generator check in examples/don-hang",
      "needs_verification": true,
      "section": 7
    },
    {
      "n": 6,
      "text": "Whoever has the database password can read the database; whoever has the JWT signing key can create tokens the API accepts as any customer.",
      "kind": "behavior",
      "source_hint": "backend.l1.issuing-a-jwt / validating-a-jwt (HMAC-SHA256 signing key); Postgres password auth",
      "needs_verification": true,
      "section": 2
    },
    {
      "n": 7,
      "text": "Secrets need stricter handling than ordinary config: kept out of the repository, shown to as few as possible, replaced when leaked; a secret printed in a shared log counts as leaked.",
      "kind": "opinion",
      "source_hint": "outline items 1-3, misconceptions",
      "needs_verification": false,
      "section": 4
    }
  ],
  "coverage": {
    "outline_items_covered": [
      1,
      2,
      3
    ],
    "outline_items_missing": [],
    "beyond_scope": []
  },
  "self_check": {
    "one_concept": true,
    "vocab_all_defined": true,
    "code_from_repo": true,
    "no_external_urls": true,
    "word_count": 1250,
    "notes": "Outline retargeted to stage-1 (DECISIONS.md §3). No secret manager or rotation, per depth_notes. Round 1 (technical): .gitignore affects untracked files only; git log wording; Compose reads .env (shell wins); full resolved config prints secrets; claims 1, 3-5."
  },
  "open_questions": [],
  "repo_changes_needed": []
}
